Tier 1,Tier 2,Tier 2 description,Tier 3,Tier 3 description short,Tier 3 description long
,,,Growth Share Matrix,Analyze business units with the Growth Share Matrix.,"Use the Growth Share Matrix (BCG Matrix) to categorize business units or products into stars, cash cows, question marks, and dogs based on market growth and market share, informing strategic investment decisions."
,,,Innovation Matrix,Foster innovation with the Innovation Matrix framework.,"Leverage the Innovation Matrix to assess and prioritize innovation initiatives, balancing between incremental and radical innovations to drive sustainable growth and competitive advantage."
,,,Kaizen,Continuous improvement through Kaizen practices.,"Implement Kaizen principles for continuous improvement in processes, involving all employees in incremental changes to enhance efficiency, quality, and overall performance."
,,,Kanban,Optimize workflow management with Kanban.,"Adopt Kanban methodology to visualize work, manage flow, and improve efficiency in task completion by using visual boards and limiting work in progress for better project management."
,,,Lean,Streamline operations and eliminate waste with Lean principles.,"Apply Lean principles to optimize processes, reduce waste, and enhance value delivery by focusing on customer needs and continuous improvement in operational efficiency."
,,,OKRs,Set and achieve goals with Objectives and Key Results (OKRs).,"Utilize OKRs to align organizational objectives with measurable key results, fostering clear goal-setting, accountability, and achievement of strategic priorities across teams and departments."
,,,PEST/PESTLE,Analyze external factors impacting business with PEST/PESTLE.,"Conduct PEST/PESTLE analysis to evaluate Political, Economic, Social, Technological, Environmental, and Legal factors affecting business operations and strategic planning."
,,,Porters 5 Forces,Assess industry competitiveness with Porters 5 Forces.,"Use Porters 5 Forces framework to analyze the competitive environment of an industry, examining the power of suppliers, buyers, competitive rivalry, threat of new entrants, and threat of substitutes to inform strategic decisions."
,,,Scrum,Enhance team collaboration and productivity with Scrum.,"Implement Scrum methodology to improve team collaboration, flexibility, and productivity in project management through iterative development, regular sprints, and continuous feedback loops."
,,,Six Sigma,Achieve process excellence with Six Sigma methodologies.,"Apply Six Sigma methodologies (DMAIC and DMADV) to enhance process quality and efficiency, reduce defects, and achieve operational excellence through data-driven decision-making and continuous improvement."
,,,Stakeholder Theory,Understand and manage organizational stakeholders with Stakeholder Theory.,"Utilize Stakeholder Theory to identify, analyze, and manage relationships with various stakeholders, ensuring their interests and influences are considered in organizational decision-making processes."
,,,SWOT Analysis,"Evaluate strengths, weaknesses, opportunities, and threats with SWOT Analysis.","Conduct SWOT Analysis to identify internal strengths and weaknesses, along with external opportunities and threats, providing a comprehensive framework for strategic planning and decision-making."
,,,TQM,Implement Total Quality Management for continuous improvement.,"Apply Total Quality Management (TQM) principles to achieve long-term success through customer satisfaction, involving all employees in continuous improvement of products, services, and processes."
,,,Value Chain Analysis,Optimize value creation with Value Chain Analysis.,"Conduct Value Chain Analysis to identify key activities that create value for customers, improving efficiency and competitive advantage by optimizing each step in the production and delivery process."
,,,Value Disciplines,Focus on key value disciplines to achieve market leadership.,"Apply the Value Disciplines framework (Operational Excellence, Product Leadership, Customer Intimacy) to determine strategic focus areas and achieve market leadership by excelling in one of these disciplines."
,Academic Mastery,Evaluate your proficiency in core academic subjects and problem-solving abilities.,Architecture,"Dive into the evolution, materials, and techniques of architecture in this assessment.","Discover the historical evolution of architecture, the materials and construction methods, architectural graphics, structural design, and building construction practices."
,,,Artificial Intelligence,"Discover the essentials of AI, including machine learning, feature extraction, and predictive models.","Gain a comprehensive understanding of AI by exploring machine learning fundamentals, feature extraction and selection techniques, and the intricacies of classification and regression to develop sophisticated predictive models."
,,,Arts & Humanities,"Delve into the core concepts of Humanities, Philosophy, Economic Development, Social Sciences, and World Religions in this comprehensive study.","Understand the foundational principles of Humanities, explore philosophical ideas, examine economic growth, analyze social sciences, and learn about global religions."
,,,Aviation & Cabin Crew,"Discover the essentials of aviation management, maintenance, operations, crew roles, and security in this comprehensive overview.","Gain insights into aviation management, aircraft maintenance, airline operations, crew responsibilities, and aviation security. Develop skills to ensure efficient operations and cooperation within the aviation industry."
,,,Civil Services,Examine the essential aspects of public service including policy analysis and urban planning.,"Gain insights into public administration, government policy analysis, international relations, and urban planning. Enhance your ability to navigate complex public affairs and policy environments."
,,,"Class 11, 12 - Arts","Explore the intersection of arts with political science, history, and geography.","Understand how arts reflect and influence political movements, historical events, and geographical landscapes. Delve into the ways arts shape and are shaped by societal contexts across different eras and regions."
,,,"Class 11, 12 - Commerce","Delve into the core concepts of accountancy, business studies, and economics for Class 11 and 12.","Gain a comprehensive understanding of financial principles, business operations, and economic theories to build a strong foundation for future studies and career opportunities."
,,,"Class 11, 12 - PCB","Explore foundational concepts in Physics, Chemistry, and Biology for Class 11 and 12 students.","Gain a comprehensive understanding of Physics, Chemistry, and Biology, essential for mastering Class 11 and 12 science curriculum. Develop analytical skills through practical experiments and theoretical knowledge."
,,,"Class 11, 12 - PCM","Dive into advanced concepts in Physics, Chemistry, and Mathematics for higher secondary education.","Explore the intricacies of Physics, Chemistry, and Mathematics, enhancing your understanding of core scientific principles and mathematical theories essential for academic excellence in Classes 11 and 12."
,,,"Class 7, 8","Discover the foundational concepts in math, science, and social sciences for students aged 7-8.","Develop a strong understanding of basic math principles, introductory science concepts, and fundamental social sciences to build a well-rounded educational foundation for young learners. Engage with interactive activities."
,,,"Class 9, 10","Explore key concepts in mathematics, science, and social science for students aged 9-10 years.","Enhance understanding of foundational mathematics, scientific principles, and social studies to build a well-rounded knowledge base for students aged 9-10 years. Foster critical thinking and problem-solving skills in these core subjects."
,,,Commerce and Finance,"Understand the core principles of commerce and finance, covering key financial management areas.","Explore financial management, investment banking, accounting, auditing, corporate finance, and fintech to develop comprehensive finance skills."
,,,Computer Science,"Gain a foundational understanding of computer science principles, programming, OS, data structures, and networks.","Develop skills in programming, operating systems, data structures, algorithms, and networking. Explore essential concepts for a solid CS foundation."
,,,Data Science,"Explore the intersection of analytics, probability, computation, machine learning, and data mining in this overview.","Dive into analytics, probability, computation, machine learning, and data mining to leverage data-driven insights for informed decision-making and innovation."
,,,Design & Fine Arts,"Explore fundamentals of visual arts, 2D & 3D design, geometry, perspective, and art history.","Dive into visual arts basics, 2D & 3D design principles, geometric concepts, perspectives in art, and historical influences. Introduction to graphic design principles."
,,,Education & Training,"This assessment explores innovations in education and training methodologies, addressing lifelong learning in a rapidly changing world.","Stay updated on trends in the education and training industry, including e-learning, curriculum development, and educational technology. Understand the impact of digital transformation on learning and teaching methods."
,,,Engineering,"Investigate engineering principles, technologies, and innovations driving advancements in various fields, from mechanical to software engineering.","Understand engineering fundamentals, design principles, and problem-solving techniques to innovate and optimize technical solutions across disciplines. Stay current with the latest engineering technologies and methods."
,,,Fashion Design,"Explore the creative fusion of textiles, design principles, pattern construction, quality assurance, and merchandising in fashion innovation.","Delve into the dynamic world of fashion design, integrating textiles, design principles, pattern making, quality analysis, and merchandising strategies to create compelling fashion collections. Understand the entire process from fabric selection to market presentation."
,,,Food & Agriculture,"Explore the interdisciplinary field encompassing agricultural science, food science, agronomy, horticulture, and agricultural economics.","Delve into the interconnected disciplines of agricultural and food sciences, agronomy, horticulture, and economics. Learn how these fields contribute to sustainable food production, environmental stewardship, and economic viability."
,,,Hospitality,"Explore the foundational aspects of the hotel industry, tourism fundamentals, and hospitality marketing along with management accounting principles.","Delve into the development of the hotel industry, tourism fundamentals, hospitality marketing strategies, and management accounting practices. Gain insights into optimizing operations and enhancing guest experiences in the hospitality sector."
,,,Law & Legal Studies,"Explore fundamental aspects of law, ethics, research, contracts, and criminal procedures in this assessment.","Gain insights into law and legal studies encompassing ethics, research methodologies, contract principles, and criminal justice procedures. Understand their interplay and practical applications."
,,,Life Sciences,"Explore fundamental aspects of biology, from cell structure and genetics to ecological systems and biochemical processes.","Delve into the diverse fields of biology, covering cell biology, genetics, ecology, and biochemistry, understanding their interconnected roles."
,,,Management,"Explore the principles and practices of efficient management encompassing HR, finance, operations, law, and ethics to optimize organizational performance.","Develop comprehensive management skills integrating HR, financial oversight, project management, legal compliance, and ethical standards. Enhance decision-making, resource allocation, and team leadership for organizational success and sustainability."
,,,Mass Communication,"Explore various facets of mass communication including journalism, digital media, PR, and ethics.","Gain insights into journalism, digital media strategies, public relations, advertising, media management, and ethical considerations in media practices."
,,,Maths & Statistics,Delve into the essential role of math and statistics in engineering applications.,"Explore fundamental mathematics, differential & integral calculus, and engineering statistics to enhance analytical skills and solve complex engineering problems."
,,,Medical Sciences,"Explore the essentials of medical sciences, covering anatomy, physiology, pharmacology, pathology, and clinical skills.","Gain comprehensive knowledge in medical sciences, including human body structure, function, drug interactions, disease mechanisms, and practical clinical skills. Essential for aspiring healthcare professionals."
,,,Performing Arts,"Delve into the vibrant world of performing arts, exploring theatre, dance, music, and production.","Discover the diverse realms of performing arts, from theatre types and character psychology to classical dance, music, and production design."
,,,Physical Sciences,"Explore the principles and applications of analytical chemistry, solvent extraction, thermodynamics, statistical physics, and environmental science.","Gain a comprehensive understanding of physical sciences, covering analytical chemistry, solvent extraction, thermodynamics, statistical physics, and environmental science. Learn practical applications and their impact on various fields."
,,,Political Science,Examine the foundational elements and evolution of political systems and theories through this assessment.,"Explore the history of politics, core political science concepts, forms of governance, foreign policy, and the role of women in politics. Gain a comprehensive understanding of political dynamics."
,,,Social Sciences,"Explore the interdisciplinary study of human behavior, culture, governance, and economic systems.","Gain insights into social psychology, anthropology, civil society and governance, economics, and psychology to understand human interactions and societal structures. Enhance critical thinking."
,,,Social Work,"Explore the principles, practices, and impact of social work in various community settings.","Understand the core concepts of social work, including social psychology, community health, policy development, and advocacy, to support and uplift communities."
,,,Supply Chain Mgmt.,"Explore the key components and processes of effective supply chain management, including its role, evolution, and phases.","Gain insights into supply chain network design, logistics, sourcing, coordination, and the impact of information technology to enhance efficiency and responsiveness in supply chain operations."
,,,,,
Extra Series,Peripheral Literacy,"Evaluate your understanding of essential life skills, including personal development, cultural awareness, and social responsibility.",Body Language,Test your understanding of non-verbal cues and how they impact communication and interactions.,"Evaluate your grasp of body language, focusing on interpreting gestures, posture, and facial expressions to enhance interpersonal communication and foster better relationships in various settings."
,,,Career Planning,Assess your knowledge of setting career goals and planning strategic moves for professional growth.,"Embark on a guided journey to build a successful career and gain insights into goal setting, self-assessment, and strategic planning to make informed decisions and achieve long-term professional growth."
,,,Common Sense,Check your practical knowledge and everyday decision-making skills in various real-life scenarios to enhance your common sense.,Explore practical decision-making and everyday problem-solving with this assessment. Learn to apply basic logic and reasoning to navigate daily situations effectively and enhance your common sense for real-world challenges.
,,,Cultural Diversity,"Explore the importance and impact of cultural diversity in the workplace, understanding how varied perspectives enhance creativity and collaboration.","Embrace cultural diversity to enrich team dynamics, foster innovation, and enhance decision-making in the workplace by leveraging diverse perspectives, backgrounds, and experiences, creating an inclusive environment."
,,,Entrepreneurship,"Explore the dynamic world of entrepreneurship through this assessment, delving into the principles of innovation, risk-taking, and business development.
","Discover how to identify opportunities, navigate challenges, and foster growth in dynamic market landscapes and innovative approaches to set the stage for impactful ventures and sustainable success in competitive environments."
,,,Mental Wellbeing,Investigate the significance of mental health and wellbeing in personal and professional domains through this assessment.,"Deepen understanding of mental health principles, stress management techniques, and strategies for cultivating resilience, emotional well-being as well as practical tools to support mental wellness and maintain a balanced lifestyle.





"
,,,Online Presence,Examine the fundamentals of establishing and maintaining a compelling digital footprint through this assessment.,"Develop essential skills in building a robust online presence, including effective social media management, content creation, and brand communication strategies to enhance visibility and achieve professional objectives."
,,,Personal Branding,Understand the art of crafting and cultivating a distinct personal brand through this assessment.,"Learn to define and communicate your unique value, cultivate an authentic online presence, and strategically position yourself for career advancement for better storytelling, networking, and leveraging digital platforms."
,,,Personal Finance,Explore the principles of effective financial management for personal growth and stability through this assessment.,"Master budgeting, saving, investing, and debt management to achieve financial independence, ensuring a secure and prosperous future through informed financial decisions and strategic wealth-building strategies."
,,,Personal Hygiene,Understand and implement effective practices to maintain personal hygiene and enhance overall well-being.,"Develop essential habits in personal hygiene to prioritize health, cleanliness, and confidence in daily routines and interactions, ensuring a positive impact on overall well-being and self-care."
,,,Personal Space,"Discover personal space's crucial role in comfort, boundaries, and overall well-being in social and professional interactions.","Learn to recognize and respect the importance of personal space in diverse environments, ensuring individuals' comfort, fostering healthy boundaries, and promoting overall psychological health and well-being."
,,,Sex Education,Explore comprehensive knowledge and understanding of human sexuality and reproductive health.,"Acquire vital knowledge in sex education to foster informed decision-making, cultivate healthy relationships, and prioritize personal well-being through understanding of human sexuality and reproductive health."
,,,Social Responsibility,Delve into the ethical duties and societal impacts of individuals and organizations on communities and the environment.,"Grasp the significance of social responsibility in nurturing ethical conduct, sustainability, and meaningful contributions to society and the environment through mindful actions and community involvement."
,,,Study Techniques,Explore effective methods and strategies for optimizing learning and retention in academic settings.,"Master study techniques tailored to learning styles, enhancing efficiency, retention, and success. Explore time management, active learning, and exam strategies for optimal outcomes and growth."
,,,Sustainability,Understand the principles and practices that promote long-term ecological balance and resource conservation.,"Grasp the significance of sustainability in fostering environmental stewardship, resource conservation, and social responsibility through mindful practices and innovative solutions, ensuring a healthy planet for future generations."
,Digital Cognizance,"Evaluate your skills in digital tools and technologies, including AI, cloud computing, data analysis, and digital marketing.",Artificial Intelligence,Learn about the principles and applications of artificial intelligence in various fields and industries.,"Understand the impact of artificial intelligence in revolutionizing industries, driving innovation, and enhancing efficiency while exploring AI technologies, ethical considerations, and real-world applications"
,,,Cloud Computing,Discover the fundamentals and applications of cloud computing in modern technology landscapes.,"Learn how cloud computing transforms data storage, processing, and accessibility by exploring its technologies, benefits, and applications to grasp its role in enhancing scalability and cost-efficiency in industries."
,,,Data Analytics,Uncover the key concepts and real-world applications of data analytics across various industries.,Utilize data analytics to drive decision-making and uncover insights. Explore techniques and tools for optimizing processes and boosting strategic planning across various industries and sectors.
,,,Digital Citizenship,Master the principles of ethical and responsible behavior in the digital world for positive online engagement.,"Adopt digital citizenship by practicing ethical online behavior, respecting digital rights, and engaging responsibly across platforms, cultivating a positive, respectful digital presence that contributes to a safer online community."
,,,Digital Commerce,"Dive into the essentials of buying and selling goods and services online, shaping modern commerce.","Navigate digital commerce by mastering online buying and selling strategies, leveraging e-commerce tools, and understanding market trends to optimize transactions and drive business success in the digital marketplace."
,,,Digital Essentials,Discover the core tools and skills necessary for effective digital navigation and productivity.,"Equip yourself with essential digital skills and tools for efficient online navigation, effective communication, and productive use of technology, enabling seamless interaction in the digital world."
,,,Digital Marketing,"Explore digital marketing strategies and tactics, including SEO, SEM, social media marketing, and content marketing, in this comprehensive assessment.","Explore digital marketing strategies, including SEO, social media, and content marketing to amplify brand presence, drive engagement, and achieve marketing goals. Measure the effectiveness of your digital marketing campaigns."
,,,Graphic Design,Delve into the principles and techniques of visual communication to create compelling designs.,"Harness the art of graphic design by mastering visual communication principles, design tools, and creative techniques to craft impactful visuals that effectively convey messages and captivate audiences across various media."
,,,Internet & Email,Navigate the fundamental skills needed for effective internet usage and communication in a digital age.,"Master the essentials of navigating the internet and managing email to enhance online research, communication efficiency, and digital organization, ensuring effective and secure interactions in a connected world."
,,,Network Security,Understand the core principles and practices of protecting computer networks from threats and vulnerabilities.,"Navigate the essentials of network security by grasping the nature of threats, defenses and employing advanced tools to safeguard data and ensure privacy against cyberattacks in our digital era."
,,,Power Search Skills,Uncover advanced techniques to effectively search and find information on the internet with precision.,"Elevate your search capabilities by mastering advanced techniques, utilizing specialized tools, and applying strategic methods to efficiently locate precise information and filter out irrelevant data."
,,,Presentation Tools,Dive into the tools and techniques essential for creating impactful and engaging presentations.,"Transform your presentation skills by harnessing powerful tools, innovative techniques, and creative strategies to design and deliver compelling presentations that captivate audiences and enhance your communication effectiveness."
,,,Prompt Engineering,Unveil the techniques and strategies for crafting effective prompts to optimize AI model outputs.,"Master the art of prompt engineering by developing precise and strategic prompts that enhance AI model performance, ensuring accurate and high-quality outputs for various applications, from language processing to automated systems."
,,,Spreadsheet Tools,Discover essential features and functions of spreadsheet tools to streamline data management and analysis.,"Harness the power of spreadsheet tools to efficiently organize, analyze, and visualize data, exploring advanced functions, formulas, and features that enhance data management, facilitate insightful analysis, and support informed decision-making."
,,,Word Processors,"Explore key features and functions of word processors to create, edit, and format documents efficiently.","Discover advanced features such as formatting options, styles, templates, and collaborative tools to streamline document creation, enhance readability, and improve productivity in various writing tasks."
