Tier 1,Tier 2,Tier 2 description,Tier 3,Tier 3 description short,Tier 3 description long
Flair Series,Numerical Ability,"Evaluate your skill in solving arithmetic problems, percentages, and data interpretation.",Arithmetic,"Assess your grasp of mathematical operations, ability to tackle problems involving arithmetic operations and measurements, with this evaluation.","Explore arithmetic skills and proficiency, focusing on fundamental arithmetic operations and fractions to strengthen numerical understanding, enhance problem-solving abilities, and achieve comprehensive mathematical development."
,,,Geometry,"Gauge your understanding of geometric concepts, identify areas of strength, and pinpoint topics that require further attention, with this assessment.","Sharpen your spatial reasoning skills, and achieve deeper comprehension of geometric concepts, enhancing problem-solving abilities, and boosting confidence in tackling mathematical challenges and geometrical puzzles."
,,,Probability and Statistics,"Delve into the realms of data, analyzing probabilities using your statistical skills, and understanding your current proficiency, with this test.","Enhance your statistical and analytical skills, by evaluating your understanding of key concepts such as probability distributions, statistical inference, data interpretation, and identify your strengths and areas for improvement."
,,,Financial Math,"Evaluate your understanding on financial calculations, knowledge of important formulae, and identify areas for improvement, with this assessment.","Assess your critical thinking skills for solving complex financial problems. Learn how to apply mathematical principles to real-world financial situations, leading to smarter investment choices and better financial management."
,,,Motion,"Analyze motion scenarios and solve complex problems on speed, acceleration, and distance using your math prowess, in this evaluation.","Strengthen your knowledge on fundamental concepts of velocity, acceleration, and Newton's laws of motion. Engage with varied problem sets, and sharpen your analytical skills crucial for tackling complex scenarios in physics and related fields."
,,,Number Theory,"Master the art of divisibility rules, building blocks of prime numbers, and number theories, with this dedicated assessment.","Sharpen your analytical and problem-solving skills to tackle complex mathematical problems. Enhance logical thinking and reasoning abilities, which are crucial in fields like computer science, cryptography, and finance."
,,,Algebra,"Conquer the world of variables and equations, and build a solid mathematical foundation by identifying your strengths, with this assessment.","Translate tricky problems into mathematical equations, use algebra to analyze problem statements, and solve inequalities, functions, and systems of equations. Sharpen your logical thinking and tackle complex algebraic equations."
,,,Time and Work,"Master Time and Work concepts like Rate of Work, Distance, and Work Efficiency, while enhancing your problem-solving skills, with this test.","Apply mathematical concepts and tackle scenarios involving planning, resource allocation, time management, work rates, distance calculations, and efficiency ratios. Improve your time management and analytical skills with this assessment."
,,,Trigonometry,"Dive into trigonometric concepts that are vital for advanced mathematics, and various scientific and engineering fields, with this assessment.","Delve into Trigonometric Ratios, Identities, Functions, and sharpen your knowledge on angles by achieving proficiency in trigonometry, which is essential in professional fields, including physics, engineering, and architecture."
,,,Data Interpretation,"Obtain successful outcomes and reduce the risk of errors by mastering this assessment, which is valuable in business, finance, and healthcare.","Dive into the realm of Data Interpretation and explore data sets, charts, graphs, and decipher trends, patterns, and insights. This assessment focuses on analyzing data, drawing conclusions, and making informed decisions."
,Verbal Reasoning,"Assess your ability to understand, analyze, and reason with language.",Antonyms & Synonyms,"Identify your vocabulary strength, ability to understand nuances, and your grasp on synonyms and antonyms, with this assessment.","Expand your vocabulary and language flexibility by mastering antonyms and synonyms, demonstrate your language skill of grasping word nuances, and your ability to choose appropriate language alternatives."
,,,Cloze Test,"Test your understanding of contextual usage and grammar rules, showcasing your command over language structure and vocabulary, with this assessment.","With this assessment, enhance your ability to understand context, recognize grammar and sentence structure, vocabulary knowledge, critical reading skills, vocabulary retention, and achieve a deeper grasp of language structure."
,,,Error Detection,"Sharpen your critical thinking by identifying grammatical, logical, and contextual errors in sentences, with this assessment.","Identify and rectify grammatical and punctuation errors, crucial for effective communication and writing proficiency. Boost your confidence in language use, ensuring clarity and accuracy in verbal and written expressions."
,,,Idioms & Phrases,"Test your ability to understand and use idiomatic expressions, enhancing language proficiency and communication skills, with this evaluation.","Delve into the world of quirky expressions that add flavor and depth to language. Gain valuable insights into your understanding of figurative language, fluency in everyday English, and the ability to express yourself creatively."
,,,Jumbled word/Paragraphs,"Demonstrate your capability to organize thoughts logically and reconstruct information in a coherent and meaningful manner, with this assessment.","Sharpen your mental agility and vocabulary by recognizing patterns and logical sequences within disorganized content. Improve your language proficiency, and evaluate your grasp of syntax, grammar, and contextual understanding."
,,,One Word Substitution,"Delve into concise expressions, showcasing your language precision and mastery, by replacing lengthy phrases with single words, in this test.","Evaluate your ability to replace a phrase or a group of words with a single, precise term. Measure your vocabulary strength, comprehension skills, linguistic accuracy, and enhance your communication abilities."
,,,Reading Comprehensions,"Sharpen your comprehension skills, understanding of written content, and ability to extract key information, with this assessment.","Gauge your ability to understand and interpret written text, analyze author's purpose and tone, draw conclusions based on hidden clues, and unearth crucial information from passages that cover wide range of subjects and genres."
,,,Syllogism & Analogies,"Evaluate your ability to identify connections, deduce conclusions, and draw parallels between different concepts, with this assessment.","Recognize relationships, draw conclusions, and understand abstract concepts, while improving your deductive reasoning and expanding cognitive flexibility. Flex your logic muscles and unveil hidden patterns in language."
,,,Vocabulary & Grammar,"Enhance your language prowess and refine your linguistic skills essential for effective communication and writing, with this assessment.","Improve your ability to express yourself precisely and effectively in any situation with strong vocabulary and grammar skills. Evaluate your grasp on word definitions, word usage, prefixes, suffixes, roots, and much more."
,,,Sentence Completion,"Test your understanding of word meanings and your ability to choose the appropriate word to complete a sentence, with this assessment.","Assess your mastery on synonyms, antonyms, and nuanced word meanings. Analyze your grasp of grammar, including correct verb forms, prepositions, conjunctions, sentence structure, collocations, subject-verb agreement, and much more."
,General Aptitude,"Measure your overall problem-solving ability, including logical reasoning, pattern recognition, and basic math skills",Binary Logic,"Dive into the world of logical operations and truth values, where every decision is based on precise binary outcomes, in this assessment.","Analyze information systematically, separating truth from fallacy. Hone your ability to identify inconsistencies and hidden flaws in arguments. Explore the logic behind decision-making processes, and improve your cognitive abilities."
,,,Caselets & Tables,"Interpret data from caselets and tables to make logical deductions. Evaluate your ability to identify trends and patterns, with this assessment.","Test your ability to read, understand, and draw conclusions from data. Enhance your capability to analyze scenarios, navigate through complex data sets, identify patterns, and solve problems using organized information."
,,,Connectives,"Sharpen your logical reasoning skills, and analyze the usage of connectives in the construction of logical arguments, with this assessment.","Explore connectives such as AND, OR, NOT, and IF-THEN, which are crucial for creating cohesive texts. Showcase your ability to link ideas and arguments coherently, highlighting your writing and reading comprehension skills."
,,,Matching/ Puzzles,"Solve intricate puzzles by applying logical reasoning to find solutions. Exercise your pattern recognition skills, with this assessment.","Enhance your cognitive abilities by engaging with logic puzzles, matching items based on given criteria, sequencing tasks, and identifying patterns. Improve your memory, attention to detail, and spatial awareness."
,,,Number and Letter Series,"Evaluate your ability to recognize patterns and sequences between numbers and letters, and enhance your problem-solving skills with this test.","Decipher complex sequences with multiplication, division, alternating patterns, letter positions within the alphabet, and strengthen your analytical thinking, critical reasoning, and attention to details, with this assessment."
,,,Blood Relations,"Delve into logical puzzles, where familial connections form the basis. Sharpen your analytical acumen and mental agility with this assessment.","Analyze and deduce complex relationships by breaking down information, identifying key details, and drawing logical conclusions. Improve your cognitive function through retention and manipulation of detailed information."
,,,Coding-Decoding,"Decipher coded messages, understand encoding techniques, and apply logical reasoning to decode hidden meanings, with this assessment.","Prepare to decode the language of cryptic messages and unravel encoded information. Break down complex patterns and spot the hidden rules. Whether it's letters, numbers, or symbols, use your logic and observation to crack the code."
,,,Logical Sequence,"Sharpen your sequencing skills, analyze patterns, and arrange elements systematically to crack logical sequences, in this assessment.","Challenge your ability to spot patterns and predict what comes next. Explore puzzles where order and arrangement hold the key to the solution. This test involves arranging items, events, or steps in a logical order based on given criteria."
,,,Seating Arrangement,"Test your ability  to visualize spatial configurations and apply logical deductions to solve seating puzzles, in this assessment.",Prepare to arrange individuals or objects based on given conditions such as seating positions in a row or around a table. Use logic and deduction to figure out specific positions or seating arrangements based on the given clues.
,,,Cause and Effect,"Get ready to uncover the underlying causes behind various scenarios and master the art of causal analysis, with this assessment.","Identify causes, predict effects, analyze the impact of events, and draw logical conclusions based on causal reasoning. Explore Cause and Effect relationships, where understanding causal connections is key to logical analysis."
,Creative Potential,Test your ability to think creatively and solve problems with originality.,Visual Perception,Interpret images and understand spatial relationships by recognizing patterns. Put your visual skills to test with this assessment.,"Evaluate how well you interpret shapes and patterns. Challenge yourself to see beyond the obvious. From recognizing patterns to perceiving depth, crack the visual codes and sharpen your observation, focus, and problem-solving skills."
,,,,,
Asset Series,Attitude Essentials,"Evaluate your understanding of positive attitudes, workplace mindset, and adaptability with this assessment.",Forward Thinking,Ready to lead the future? Test your forward-thinking skills & see where your vision takes you.,"This assessment gauges your ability to anticipate future trends, plan strategically, and set ambitious goals. Discover if you're a trendsetter or a follower!"
,,,Gratitude Practice,How well do you appreciate the good stuff? Take our assessment & discover your gratitude superpower.,"This assessment reveals your natural tendency towards gratitude. Do you focus on the bright side? Learn how to cultivate an appreciative mindset for a happier, more fulfilling life."
,,,Grit & Resilience,Bounce back from setbacks! Test your grit & resilience & see how you overcome challenges.,This assessment explores your determination and perseverance. Do you give up easily or rise above obstacles? Discover your inner strength and strategies to build resilience.
,,,Growth Mindset,Believe you can learn & grow? Take the growth mindset assessment & unlock your full potential.,This assessment reveals your belief in your ability to learn and develop. Do you see challenges as opportunities or limitations? Discover a growth mindset for success.
,,,Integrity & Ethics,Do what's right! Test your integrity & see if your actions align with your values.,This assessment explores your commitment to honesty and ethical behavior. Do you stand by your principles even when it's difficult? Discover how strong your moral compass is.
,,,Lifelong Learning,Never stop exploring! Test your love for learning & see if you're a lifelong learner.,This assessment gauges your curiosity and desire for continuous learning. Do you embrace new information or resist change? Discover your learning style and fuel your lifelong journey.
,,,Open-Mindedness,Consider all sides! Test your open-mindedness & see if you embrace new perspectives.,This assessment explores your willingness to consider different viewpoints. Do you judge quickly or listen with an open mind? Discover how receptive you are to new ideas.
,,,Positive Outlook,See the silver lining! Test your positive outlook & bring sunshine to your life.,This assessment explores your natural tendency towards optimism. Do you focus on the negative or see the good in every situation? Discover how to cultivate a positive outlook for greater happiness.
,,,Proactive Actions,"Don't wait, take charge! Test your proactive skills & see if you make things happen.",This assessment explores your initiative and ability to take action. Do you wait for things to happen or go after your goals? Discover your proactive potential and become a go-getter.
,,,Trustworthiness,Be someone people can rely on! Test your trustworthiness & build strong relationships.,"This assessment explores your honesty, reliability, and commitment to keeping promises. Do you build trust easily or struggle with keeping your word? Discover how to be dependable and trustworthy."
,Personal Efficiency,"Assess your ability to manage time, prioritize tasks, and boost productivity with this evaluation.",Adaptability Skills,Take our online assessment and test your ability to thrive in change! See how adaptable you are.,"This short assessment measures your adaptability skills, essential for personal efficiency. Discover how well you adjust to new situations, learn quickly, and solve problems creatively in a changing world."
,,,Managing Goals,Take our online assessment and gain valuable insights into your strengths and weaknesses when it comes to setting and achieving objectives.,"Assess your ability to set SMART goals, prioritize tasks, and stay focused. This free online goal management skills test helps you identify areas for improvement and develop a personalized plan for success."
,,,Managing Stress,Feeling overwhelmed? Test your stress management skills & find techniques for a calmer you. Take the quiz!,"Our free online Stress Management Assessment reveals your stress levels & coping mechanisms. Learn how you handle pressure & discover personalized tips for a more balanced, stress-free life."
,,,Managing Time,Time slipping away? Assess your time management & discover strategies to get more done.,"Is your to-do list taking over? Take our free Time Management Assessment to identify your strengths & weaknesses. Learn how to prioritize tasks, schedule effectively, and conquer your day."
,,,Organization Skills,Feeling scattered? Assess your organization & discover tools to streamline your life. Take the test!,"Our free Organization Skills Assessment helps you identify areas for improvement. Discover your organizational style, learn effective planning techniques, and gain valuable tips to get organized & stay on top of things."
,,,Productivity Skills,Want to achieve more? Assess your productivity & discover strategies to boost your output.,"Take our free Productivity Skills Assessment and unlock your full potential. Identify what hinders your progress & discover personalized strategies for maximizing your focus, minimizing distractions, and achieving your goals."
,,,Self Awareness,Know thyself! Assess your self-awareness & unlock your hidden potential. Take the quiz!,"Our free Self Awareness Assessment helps you understand your strengths, weaknesses, values, and motivations. Gain valuable insights into your personality & discover how to leverage your self-knowledge for success and fulfillment."
,,,Self Confidence,Believe in yourself! Assess your confidence & discover ways to become unstoppable.,"Feeling unsure? Take our free Self Confidence Assessment to identify areas for growth. Discover techniques to build confidence, overcome self-doubt, and unlock your full potential to achieve your goals."
,,,Self Discipline,Follow through on goals! Assess your self-discipline & discover ways to stay focused.,"Do you struggle to stick to plans? Our free Self Discipline Assessment helps you identify areas for improvement. Learn techniques to develop self-control, manage distractions, and achieve your goals with greater focus and determination."
,,,Self Motivation,Stay inspired & motivated! Assess your self-motivation & discover ways to stay on track.,"Feeling unmotivated? Take our free Self Motivation Assessment to identify what fuels your drive. Learn techniques to set goals, overcome challenges, and stay motivated to achieve your aspirations."
,Social Competency,"Measure your interpersonal skills, communication abilities, and teamwork dynamics in various social settings.",Active Listening,Are you a good listener? Test your active listening skills with our free online assessment!,"This assessment evaluates your ability to truly focus on a speaker, understand their message, and respond thoughtfully. Discover your strengths and weaknesses in active listening, a key skill for building strong relationships."
,,,Assertiveness,Express yourself confidently! Take our assertiveness assessment & find your voice.,This assessment helps you understand how effectively you communicate your needs and opinions while respecting others. Discover your assertiveness style and learn to express yourself clearly and confidently.
,,,Collaboration,Team player? Take our assessment to see your collaboration skills for work & life.,"This assessment evaluates your ability to work effectively with others towards a common goal. Discover your strengths in teamwork, communication, and conflict resolution to become a valuable collaborator."
,,,Communication,Sharpen your communication skills! Take our free online assessment today.,"This assessment evaluates your written and verbal communication skills, including clarity, conciseness, and effectiveness. Identify areas for improvement and learn how to communicate confidently and persuasively."
,,,Emotional Intelligence,How well do you manage emotions? Test your EQ with our free online assessment.,"Explore the role of emotional intelligence in fostering personal and professional success, improving relationships, and enhancing leadership skills while understanding key components such as self-awareness, empathy, and social interaction in real-world scenarios."
,,,Influencing Skills,Become more persuasive! Take our assessment to boost your influencing skills.,This assessment evaluates your ability to motivate and inspire others. Discover your influencing style and learn techniques to effectively present your ideas and get buy-in from others.
,,,Negotiation Skills,Sharpen your negotiation skills! Take our assessment to win every deal.,"This assessment evaluates your ability to negotiate win-win outcomes. Discover your strengths and weaknesses in negotiation strategies, communication, and compromise to become a more effective negotiator."
,,,Networking Skills,Build strong connections! Take our assessment to boost your networking skills.,"This assessment evaluates your ability to build and maintain professional relationships. Discover how to effectively network, connect with others, and build a strong professional network."
,,,Presentation Skills,Captivate your audience! Take our assessment to be a presentation pro.,"This assessment evaluates your ability to deliver clear, concise, and engaging presentations. Identify areas for improvement in content, delivery, and audience engagement to become a confident and impactful presenter."
,,,Teamwork Skills,Become a team player! Take our assessment to strengthen your teamwork skills.,"This assessment evaluates your ability to collaborate effectively within a team. Discover your strengths in communication, conflict resolution, and shared goals to become a valuable team member."
,Professional Vitals,"Test your grasp of key professional behaviors, workplace ethics, and business etiquette with this assessment.",Accountability,Test your commitment to achieving goals and taking ownership of results. Assess your Accountability online now!,This online assessment measures your commitment to delivering results & taking responsibility for actions. Test your Accountability skills & identify areas for improvement.
,,,Attention to detail,Strengthen your focus and ensure accuracy by taking the Attention to Detail assessment online.,Assess your ability to identify & handle intricate details. This online Attention to Detail test measures your focus & accuracy. Improve your skills to avoid mistakes.
,,,Decision Making,"Strong decision-making skills are essential for solving problems, overcoming challenges, and achieving success in any professional setting. Assess your Decision-Making skills online.",Test your ability to analyze & make effective decisions under pressure. This online Decision-Making assessment helps identify your strengths & areas for improvement in critical thinking.
,,,Leadership Skills,"Do you have the vision, inspiration, and courage to lead others? Take the online Leadership Skills assessment and discover your potential.","Do you have what it takes to inspire & guide others? This online Leadership Skills assessment evaluates your ability to motivate, delegate & navigate challenges."
,,,Resourcefulness,A resourceful person is adept at finding unconventional solutions and can often come up with new and innovative approaches.Think outside the box! Assess your Resourcefulness online.,Test your ability to find creative solutions with limited resources. This online Resourcefulness assessment measures your problem-solving skills & adaptability.
,,,Sense of Urgency,"Don't miss deadlines! Assess your Sense of Urgency online and discover your ability to prioritize tasks, manage time effectively, and take action when needed.",Evaluate your ability to prioritize tasks & work effectively under time pressure. This online Sense of Urgency assessment helps identify areas for improvement in time management and develop the skills to consistently meet deadlines and deliver results on time.
,,,Work Etiquettes,Sharpen your professional edge! Take the Work Etiquettes assessment online and demonstrate your understanding of professional conduct and communication in the workplace.,Test your understanding of professional conduct & communication. This online Work Etiquettes assessment measures your ability to interact respectfully & build trust in the workplace.
,,,Work Life Balance,Achieve fulfillment in & out of work! Assess your Work-Life Balance online.,Evaluate your ability to manage work demands & personal priorities effectively. This online Work-Life Balance assessment helps identify areas for improvement in maintaining a healthy balance.
,,,Multitasking Skills,Juggle tasks efficiently! Assess your Multitasking Skills online.,Test your ability to manage multiple tasks simultaneously while maintaining accuracy. This online Multitasking Skills assessment helps identify areas for improvement in focus & prioritization.
,,,Cultural fitness,Adapt & thrive in diverse settings! Assess your Cultural Fitness online.,Evaluate your ability to understand & navigate different cultural norms & perspectives. This online Cultural Fitness assessment helps you develop skills for working effectively in a globalized world.
,,,,,
