Tier 1,Tier 2,Tier 2 description,Tier 3,Tier 3 description short,Tier 3 description long
Craft Series,Functional Acumen,Test your grasp of key functions and practical problem-solving skills.,Administration,Explore the principles and practices of efficient administrative management in organizations through this assessment.,"Develop administrative skills in office management, record keeping, scheduling, and coordination to ensure streamlined operations and organizational efficiency. Enhance your ability to manage office resources effectively."
,,,AI and Automation,"Delve into the realm of artificial intelligence and automation technologies, assessing their applications and impact across industries.","Understand AI and automation, focusing on machine learning and robotic process automation to drive innovation and operational efficiency in various industries. Stay updated on emerging AI trends and technologies."
,,,Business Development,"This assessment explores strategies and methodologies for fostering business growth, including market expansion and client acquisition.","Gain insights into business development strategies, market analysis, and relationship building to drive growth and forge strategic partnerships. Learn how to identify and capitalize on new market opportunities."
,,,Communications,Investigate effective communication strategies and their role in enhancing organizational effectiveness and stakeholder engagement.,"Master communication strategies, including verbal, non-verbal, written, and digital communication to enhance professional interactions and efficacy. Develop skills for effective public speaking and presentations."
,,,Creative Services,"Explore the dynamic world of creative services, from design thinking to content creation and branding strategies, in this assessment.","Explore creative services like graphic design, content creation, and multimedia production to deliver innovative and visually compelling solutions. Understand the principles of effective visual communication."
,,,CSR & Sustainability,"Examine corporate social responsibility (CSR) initiatives and sustainability practices, assessing their impact on communities and the environment.","Understand corporate social responsibility, focusing on ethical practices, environmental stewardship, and community engagement for a positive global impact. Implement CSR initiatives that align with your organizational goals."
,,,Customer Service,"Assess customer service strategies, focusing on enhancing customer satisfaction, loyalty, and retention through effective service delivery.","Enhance customer service skills in communication, problem-solving, and relationship management to achieve exceptional client satisfaction and loyalty. Learn techniques for handling difficult customer interactions."
,,,Data Science and Analytics,"Dive into data science and analytics methodologies, exploring their role in deriving insights and making informed business decisions.","Delve into data science and analytics, covering data collection, analysis, and visualization techniques to drive data-driven decision-making and insights. Master tools like Python, R, and Tableau for data analysis."
,,,Artificial Intelligence,"Discover the essentials of AI, including machine learning, feature extraction, and predictive models.","Gain a comprehensive understanding of AI by exploring machine learning fundamentals, feature extraction and selection techniques, and the intricacies of classification and regression to develop sophisticated predictive models."
,,,Engineering,"Investigate engineering principles, technologies, and innovations driving advancements in various fields, from mechanical to software engineering.","Understand engineering fundamentals, design principles, and problem-solving techniques to innovate and optimize technical solutions across disciplines. Stay current with the latest engineering technologies and methods."
,,,Facilities Management,"Examine facilities management practices, including maintenance, operations, and sustainability initiatives, in this assessment.","Learn facilities management, encompassing maintenance, space planning, and safety protocols to ensure efficient operations and functionality of premises. Implement energy-efficient practices in facilities management."
,,,Finance & Accounting,"This assessment explores principles of finance and accounting, including financial analysis, reporting, and strategic financial management.","Gain expertise in finance and accounting, covering financial planning, budgeting, and analysis to drive fiscal responsibility and strategic investments. Understand financial statements and key performance indicators (KPIs)."
,,,Human Resources (HR),"Dive into HR strategies and practices, focusing on talent management, employee engagement, performance management, and organizational development.","Understand HR practices, including talent management, employee relations, and organizational development to foster a productive and motivated workforce. Implement effective performance appraisal and feedback systems."
,,,Information Security,"Explore information security principles, cybersecurity measures, and risk management strategies to protect organizational data and assets.","Delve into information security principles, threat management, and compliance to safeguard data, ensure cybersecurity, and maintain data integrity. Learn about emerging cybersecurity threats and how to mitigate them."
,,,Information Technology,"Investigate IT infrastructure, systems management, cybersecurity, and emerging technologies shaping the IT landscape in this assessment.","Explore IT solutions, covering systems management, software development, and IT infrastructure to enhance technological advancements and efficiency. Implement best practices for IT project management and system integration."
,,,Legal and Compliance,"Assess legal frameworks, compliance standards, and risk mitigation strategies crucial for organizational governance and operations.","Understand legal and compliance requirements, including corporate law, regulatory frameworks, and risk management to ensure adherence to standards. Develop strategies for effective risk management and legal compliance."
,,,Marketing,"Explore marketing strategies, consumer behavior analysis, branding, and market research methodologies in this comprehensive assessment.","Gain insights into marketing strategies, including market research, brand management, and promotional tactics to drive strategy and consumer engagement. Create compelling brand narratives and marketing campaigns."
,,,Operations,"Examine operations management principles, focusing on efficiency, quality control, supply chain management, and process optimization.","Explore operational strategies, including process optimization, resource management, and quality control to ensure streamlined processes and productivity. Implement lean management principles to reduce waste and improve efficiency."
,,,Planning & Strategy,"This assessment explores strategic planning processes, including goal setting, SWOT analysis, competitive analysis, and strategic decision-making.","Learn strategic planning techniques, goal setting, and resource allocation to drive organizational vision, achieve goals, and ensure long-term success. Develop a strategic plan that aligns with organizational objectives."
,,,Procurement,"Investigate procurement strategies, supplier management, negotiation tactics, and supply chain optimization in this assessment.","Understand procurement processes, vendor management, and negotiation tactics to ensure efficient supply chain management and cost-effective procurement. Develop strategies for building strong vendor relationships."
,,,Production,"Dive into production management principles, including manufacturing processes, inventory management, and lean production techniques.","Delve into production management principles, covering workflow optimization, quality control, and resource allocation for efficient and high-quality outputs. Implement just-in-time (JIT) production techniques."
,,,Project Management,"Explore project management methodologies, including planning, execution, monitoring, and project risk management strategies.","Gain expertise in project management methodologies, risk assessment, and stakeholder communication to ensure successful project execution and goal attainment. Utilize project management tools like Agile and Scrum."
,,,Public Relations,"Examine public relations strategies, media relations, crisis communication, and reputation management practices in this assessment.","Understand public relations strategies, media engagement, and crisis communication to enhance brand reputation and manage public perception effectively. Develop a crisis communication plan to address potential issues swiftly."
,,,Quality (QA/QC),"Assess quality assurance and quality control principles, methodologies, and standards ensuring product and service excellence.","Explore quality assurance techniques, covering process audits, quality control, and regulatory compliance to ensure high standards and industry adherence. Implement continuous improvement processes to enhance quality."
,,,Research (R&D),"Explore research and development (R&D) processes, innovation strategies, and technology advancements driving product and service innovation.","Gain insights into research and development methodologies, including product innovation, market analysis, and experimental design to drive innovation. Develop strategies for fostering a culture of innovation within your organization."
,,,Risk Management,"Examine risk management frameworks, risk assessment methodologies, and mitigation strategies crucial for organizational resilience.","Understand risk management principles, including risk assessment, mitigation strategies, and contingency planning to ensure business continuity. Develop comprehensive risk management frameworks and plans."
,,,Sales,"This assessment explores sales strategies, relationship management, negotiation skills, and sales performance analytics.","Learn sales techniques, customer relationship management, and negotiation skills to drive revenue growth, enhance customer acquisition, and meet targets. Implement CRM systems to manage customer relationships effectively."
,,,Supply Chain & Logistics,"Dive into supply chain management principles, logistics operations, inventory management, and global supply chain strategies.","Explore supply chain management, logistics optimization, and inventory control to ensure seamless operations and cost-effective supply chain processes. Implement strategies for optimizing logistics and reducing inventory costs."
,,,Talent Acquisition,"Investigate talent acquisition strategies, recruitment techniques, employer branding, and candidate assessment methodologies in this assessment.","Understand talent acquisition strategies, including recruitment, candidate assessment, and employer branding to attract and retain top talent. Develop employer branding strategies to attract the best candidates."
,,,Training & Development,"Explore training and development strategies, including employee learning programs, skills development initiatives, and training ROI analysis.","Gain insights into training methodologies, learning management systems, and employee development programs to foster continuous learning and growth. Implement training programs that address current skill gaps and future needs."
,Industry Awareness,"Assess your understanding of key industry sectors, including current trends, challenges, and sector-specific knowledge across various fields.",Agriculture,This assessment explores modern agricultural practices and their critical impact on global food security and sustainability.,"Understand modern agricultural practices, sustainable farming, and technological advancements to increase productivity and environmental stewardship. Learn about precision farming and its impact on crop yield and resource efficiency."
,,,Automotive,"Dive into the world of automotive technology and innovation, assessing its pivotal role in shaping cutting-edge transportation solutions.","Explore the latest trends in the automotive industry, including electric vehicles, autonomous driving, and advanced manufacturing techniques. Understand the role of AI and IoT in transforming vehicle design and user experience."
,,,Aviation & Aerospace,"Discover the forefront of aviation and aerospace industries in this assessment, exploring advancements in air travel and space exploration.","Gain insights into the aviation and aerospace industry, focusing on technological advancements, safety protocols, and regulatory frameworks. Learn about the latest innovations in aircraft design and space exploration."
,,,Beauty & Fashion,Uncover the latest trends and innovations driving the dynamic beauty and fashion industries in this assessment.,"Stay updated on trends in the beauty and fashion industry, including sustainable fashion, consumer behavior, and digital marketing. Understand the impact of social media and influencers on brand perception and sales."
,,,Biotech & Pharma,"Navigate the complexities of biotechnology and pharmaceutical sectors, focusing on advancements in healthcare and life sciences.","Delve into the biotechnology and pharmaceutical industry, focusing on drug development, regulatory compliance, and advancements in medical technology. Learn about emerging trends like personalized medicine and gene therapy."
,,,BPO & KPO,This assessment analyzes the critical roles of Business Process Outsourcing (BPO) and Knowledge Process Outsourcing (KPO) in global business operations.,"Understand the business process outsourcing (BPO) and knowledge process outsourcing (KPO) industries, focusing on operational efficiency, service quality, and technological integration. Explore strategies for managing global outsourcing projects."
,,,Chemicals,"Examine the role of chemical industries in manufacturing, healthcare, and environmental sustainability through this assessment.","Explore the chemical industry, including production processes, safety protocols, and environmental impact. Understand the role of innovation in developing new chemical products and improving sustainability."
,,,Construction & Real Estate,"Explore construction projects, real estate markets, and urban planning challenges in this comprehensive assessment.","Gain insights into the construction and real estate industry, covering project management, sustainable building practices, and market trends. Learn about the impact of technology on construction methods and real estate transactions."
,,,Defence & Military,Assess technological advancements and strategic considerations in defense and military operations globally.,"Understand the defence and military industry, focusing on technological advancements, strategic planning, and regulatory frameworks. Learn about the latest developments in defence technology and their implications for national security."
,,,Education & Training,"This assessment explores innovations in education and training methodologies, addressing lifelong learning in a rapidly changing world.","Stay updated on trends in the education and training industry, including e-learning, curriculum development, and educational technology. Understand the impact of digital transformation on learning and teaching methods."
,,,Energy & Renewables,"Dive into energy resources, renewable technologies, and sustainable practices shaping global energy needs.","Explore the energy and renewables industry, focusing on sustainable energy sources, technological innovations, and regulatory challenges. Learn about the impact of renewable energy on global energy markets and environmental sustainability."
,,,Financial Services (BFSI),"Explore the intricate workings of the BFSI sector, including banking, insurance, fintech innovations, and global financial markets.","Gain insights into the financial services industry, including banking, insurance, and investment management. Understand the impact of fintech innovations and regulatory changes on financial markets and consumer behavior."
,,,Food & FMCG,"Examine trends and challenges in the Food and Fast-Moving Consumer Goods (FMCG) sectors, from farm to consumer insights.","Understand the food and fast-moving consumer goods (FMCG) industry, focusing on supply chain management, consumer trends, and product innovation. Learn about strategies for ensuring product quality and sustainability in the food industry."
,,,Gems & Jewelery,Discover the craftsmanship and market dynamics of the gems and jewelry industry in this insightful assessment.,"Explore the gems and jewelry industry, covering market trends, manufacturing processes, and consumer behavior. Understand the impact of digital marketing and e-commerce on jewelry sales and brand perception."
,,,Govt. & Public Sector,"Analyze the pivotal role of governments and public sector organizations in shaping policy, governance, and public service delivery.","Gain insights into the government and public sector, focusing on policy development, public administration, and digital transformation. Learn about strategies for improving public services and ensuring regulatory compliance."
,,,Healthcare & Social Care,"This assessment explores the intersection of healthcare services and social care systems, focusing on patient care and wellness innovations.","Understand the healthcare and social care industry, covering patient care, healthcare technology, and regulatory compliance. Learn about emerging trends in telemedicine and personalized healthcare solutions."
,,,IT Hardware,"Investigate the evolution of IT hardware technologies, from computing devices to IoT and AI applications in this assessment.","Explore the IT hardware industry, focusing on technological advancements, supply chain management, and market trends. Understand the impact of emerging technologies like IoT and AI on IT hardware development and usage."
,,,IT Software,"Delve into software development, applications, platforms, and cloud computing solutions in this comprehensive assessment.","Gain insights into the IT software industry, including software development methodologies, cybersecurity, and market trends. Learn about the impact of cloud computing and AI on software solutions and business operations."
,,,Manufacturing,"Examine the processes, technologies, automation, and supply chain management innovations driving modern manufacturing industries.","Understand the manufacturing industry, focusing on production processes, quality control, and technological innovations. Learn about strategies for implementing lean manufacturing and Industry 4.0 practices to enhance productivity and efficiency."
,,,Media & Entertainment,"Explore the dynamic landscape of media and entertainment industries, from digital content creation to distribution strategies.","Stay updated on trends in the media and entertainment industry, including digital media, content creation, and consumer behavior. Understand the impact of streaming services and social media on content consumption and marketing strategies."
,,,Metals & Mining,"Investigate global mining operations, metallurgical processes, and sustainable resource management strategies in this assessment.","Explore the metals and mining industry, covering extraction processes, market trends, and environmental impact. Understand the role of technological innovations in improving mining efficiency and reducing environmental footprint."
,,,Oil & Gas,"This assessment explores the complexities of the oil and gas industry, from exploration and production to global energy market dynamics.","Gain insights into the oil and gas industry, focusing on exploration, production, and market dynamics. Learn about the impact of renewable energy and technological innovations on the future of the oil and gas sector."
,,,Professional Services,"Analyze the evolution and impact of professional services firms, including legal, consulting, accounting, and advisory services.","Understand the professional services industry, including consulting, legal, and accounting services. Learn about strategies for enhancing client relationships, improving service delivery, and staying competitive in a dynamic market."
,,,Retail & E-Commerce,"Explore retail trends, e-commerce innovations, and customer experience strategies in this insightful assessment.","Explore the retail and e-commerce industry, focusing on consumer behavior, digital transformation, and supply chain management. Understand the impact of omnichannel strategies and AI on retail operations and customer experience."
,,,Shipping & Maritime,"Navigate the global shipping and maritime industries, addressing logistics challenges, sustainability efforts, and trade dynamics.","Gain insights into the shipping and maritime industry, covering logistics, regulatory compliance, and technological advancements. Learn about strategies for improving shipping efficiency and reducing environmental impact."
,,,Sports & Wellness,"Delve into sports technologies, sports medicine advancements, and global wellness initiatives in this assessment.","Understand the sports and wellness industry, focusing on fitness trends, health technologies, and market dynamics. Learn about the impact of digital platforms and wearable technology on consumer engagement and health outcomes."
,,,Telecommunications,"Examine telecommunications technologies, 5G advancements, satellite communications, and global connectivity in this assessment.","Explore the telecommunications industry, covering network infrastructure, regulatory challenges, and technological innovations. Understand the impact of 5G and IoT on telecommunications services and business models."
,,,Textile & Apparels,"Investigate fashion trends, sustainable practices in textile manufacturing, and global supply chain dynamics in this assessment.","Gain insights into the textile and apparel industry, focusing on production processes, market trends, and sustainability. Learn about the impact of technological innovations and ethical practices on the textile and apparel sector."
,,,Tourism & Hospitality,"Explore tourism dynamics, hospitality innovations, and destination management strategies in this comprehensive assessment.","Understand the tourism and hospitality industry, covering travel trends, customer service, and digital transformation. Learn about strategies for enhancing guest experiences and managing hospitality operations effectively."
,,,Transport & Logistics,Examine the critical role of transport and logistics sectors in global supply chains and mobility solutions in this assessment.,"Explore the transport and logistics industry, focusing on supply chain management, technological innovations, and regulatory challenges. Understand the impact of automation and digitalization on logistics efficiency and cost-effectiveness."
,Business Concepts,Assess your understanding of fundamental business principles and practices.,5S Methodology,Streamline and optimize workspace organization and efficiency with the 5S Methodology.,"Implement the 5S Methodology (Sort, Set in order, Shine, Standardize, Sustain) to improve workplace efficiency, safety, and productivity by maintaining a clean and organized environment."
,,,7-S Framework,Assess organizational effectiveness using the 7-S Framework.,"Analyze key organizational elements: Strategy, Structure, Systems, Shared Values, Skills, Style, and Staff to ensure alignment and improve performance through the 7-S Framework."
,,,9-Box Grid,Evaluate employee performance and potential with the 9-Box Grid.,"Utilize the 9-Box Grid to assess employee performance and potential, aiding in talent management and development strategies to identify future leaders and areas for improvement."
,,,Agile,Explore Agile methodologies for adaptive project management.,"Embrace Agile methodologies to enhance flexibility, collaboration, and customer satisfaction in project management through iterative development and continuous improvement."
,,,Ansoff Matrix,Discover growth strategies with the Ansoff Matrix.,"Apply the Ansoff Matrix to identify growth opportunities through market penetration, market development, product development, and diversification strategies for business expansion."
,,,Balanced Scorecard,Measure organizational performance with the Balanced Scorecard.,"Implement the Balanced Scorecard to track key performance indicators across financial, customer, internal process, and learning and growth perspectives to achieve strategic objectives."
,,,Blue Ocean Strategy,Create uncontested market space with Blue Ocean Strategy.,"Develop innovative strategies to enter new markets and differentiate products, avoiding competition and creating unique value propositions using Blue Ocean Strategy principles."
,,,Design Thinking,Innovate solutions through Design Thinking methodology.,"Apply Design Thinking to foster creativity and user-centric solutions by empathizing with users, defining problems, ideating, prototyping, and testing innovative products or services."
,,,Fishbone,Identify root causes of problems using Fishbone Diagrams.,"Utilize Fishbone Diagrams (Ishikawa Diagrams) to systematically analyze and identify root causes of issues in processes, aiding in problem-solving and continuous improvement initiatives."
,,,Gap Analysis,Bridge the gap between current and desired performance with Gap Analysis.,"Conduct Gap Analysis to identify discrepancies between current performance and desired outcomes, enabling targeted strategies to close performance gaps and achieve organizational goals."
