Tier 1,Tier 2,Tier 2 description,Tier 3,Tier 3 description short,Tier 3 description long
,Lingual Proficiency,"Measure your command of language skills, including grammar, vocabulary, and effective communication across various contexts.",Bengali,"Learn the basics of the Bengali language, including script, grammar, and fundamental communication skills.","Immerse yourself in the Bengali language by mastering its script, grammar, and pronunciation, developing key communication skills to engage effectively, appreciate cultural contexts, and achieve proficiency in reading, writing, and speaking Bengali."
,,,Marathi,"Learn the basics of the Marathi language, including its script, grammar, and foundational communication skills.","Delve into Marathi by mastering its script, grammar, and pronunciation, and develop essential communication skills to interact effectively, appreciate cultural contexts, and achieve proficiency in reading, writing, and speaking Marathi."
,,,Telugu,"Learn the basics of the Telugu language, including its script, grammar, and fundamental communication skills.","Immerse yourself in Telugu by mastering its script, grammar, and pronunciation, and develop essential communication skills to engage effectively, understand cultural contexts, and achieve proficiency in reading, writing, and speaking Telugu."
,,,Tamil,"Explore the essentials of the Tamil language, including its script, grammar, and foundational communication skills.","Engage with Tamil by mastering its script, grammar, and pronunciation, and develop key communication skills to interact effectively, grasp cultural nuances, and achieve proficiency in reading, writing, and speaking Tamil."
,,,Gujarati,"Learn the fundamentals of the Gujarati language, including script, grammar, and basic communication skills.","Engage with the Gujarati language by mastering its script, grammar, and pronunciation, and build essential communication skills to interact effectively, understand cultural contexts, and achieve proficiency in reading, writing, and speaking Gujarati."
,,,Urdu,"Discover the essentials of the Urdu language, including its script, grammar, and basic communication skills.","Delve into Urdu by mastering its script, grammar, and pronunciation, and cultivate crucial communication skills to interact effectively, appreciate cultural nuances, and achieve proficiency in reading, writing, and speaking Urdu."
,,,Kannada,"Learn the essentials of Kannada, including its script, grammar, and basic communication skills.","Delve into Kannada by mastering its script, grammar, and pronunciation, and cultivate essential communication skills to interact effectively, appreciate cultural nuances, and achieve proficiency in reading, writing, and speaking Kannada."
,,,Odia,"Explore the essentials of the Odia language, including its script, grammar, and basic communication skills.","Immerse yourself in Odia by mastering its script, grammar, and pronunciation, and develop crucial communication skills to engage effectively, understand cultural contexts, and achieve proficiency in reading, writing, and speaking Odia."
,,,Malayalam,"Discover the fundamentals of the Malayalam language, including its script, grammar, and basic communication skills.","Immerse yourself in Malayalam by mastering its script, grammar, and pronunciation, and develop essential communication skills to interact effectively, grasp cultural nuances, and achieve proficiency in reading, writing, and speaking Malayalam."
,,,Punjabi,"Learn the basics of Punjabi, focusing on its script, grammar, and fundamental communication skills.","Immerse yourself in Punjabi by mastering its script, grammar, and pronunciation, and develop key communication skills to interact effectively, appreciate cultural nuances, and achieve proficiency in reading, writing, and speaking Punjabi."
,,,German,"Explore the basics of the German language, including its script, grammar, and foundational communication skills.","Dive into the German language by mastering its script, grammar, and pronunciation, and develop essential communication skills to interact effectively, grasp cultural nuances, and attain proficiency in reading, writing, and speaking German."
,,,Japanese,"Discover the basics of the Japanese language, focusing on script, grammar, and foundational communication skills.","Immerse yourself in Japanese by mastering its script, grammar, and pronunciation, and develop essential communication skills to interact effectively, understand cultural nuances, and gain proficiency in reading, writing, and speaking Japanese."
,,,French,"Dive into the fundamentals of the French language, focusing on script, grammar, and basic communication skills.","Immerse yourself in French by mastering its script, grammar, and pronunciation, and develop essential communication skills to engage effectively, understand cultural nuances, and achieve proficiency in reading, writing, and speaking French."
,,,Korean,"Uncover the basics of the Korean language, including script, grammar, and foundational communication skills.","Dive into Korean by mastering its script, grammar, and pronunciation, and develop key communication skills to engage effectively, understand cultural contexts, and attain proficiency in reading, writing, and speaking Korean."
,,,Mandarin,"Explore the basics of Mandarin, focusing on its script, grammar, and fundamental communication skills.","Engage with Mandarin by mastering its script, grammar, and pronunciation, and develop key communication skills to effectively interact, understand cultural nuances, and gain proficiency in reading, writing, and speaking Mandarin."
,,,Spanish,"Discover the fundamentals of the Spanish language, including its script, grammar, and basic communication skills.","Immerse yourself in Spanish by mastering its script, grammar, and pronunciation, and develop essential communication skills to interact effectively, appreciate cultural contexts, and achieve proficiency in reading, writing, and speaking Spanish."
,,,Arabic,"Explore the fundamentals of the Arabic language, including script, grammar, and basic communication skills.","Delve into the Arabic language by mastering its script, grammar, and pronunciation, developing essential communication skills to engage effectively, understand cultural nuances, and gain proficiency in reading, writing, and speaking Arabic."
,,,Portuguese,"Discover the basics of the Portuguese language, including its script, grammar, and fundamental communication skills.","Engage with Portuguese by mastering its script, grammar, and pronunciation, and develop essential communication skills to interact effectively, understand cultural contexts, and achieve proficiency in reading, writing, and speaking Portuguese."
,,,Russian,"Uncover the basics of the Russian language, including its script, grammar, and fundamental communication skills.","Dive into Russian by mastering its script, grammar, and pronunciation, and develop essential communication skills to engage effectively, understand cultural nuances, and gain proficiency in reading, writing, and speaking Russian."
,,,English L1,"Master the fundamentals of English as a first language, including grammar, vocabulary, and effective communication.","Enhance your proficiency in English as a first language by mastering grammar, expanding vocabulary, and refining communication skills, ensuring effective expression, comprehension, and application in diverse contexts and interactions."
,,,English L2,"Develop skills in English as a second language, focusing on grammar, vocabulary, and effective communication.","Advance your English as a second language by improving grammar, expanding vocabulary, and honing communication skills, facilitating better understanding, expression, and interaction in diverse contexts and everyday situations."
,,,English L3,"Enhance your skills in English as a third language, including grammar, vocabulary, and advanced communication techniques.","Strengthen your proficiency in English as a third language by refining grammar, expanding vocabulary, and mastering advanced communication techniques, enabling effective expression and interaction in diverse situations."
,,,Hindi L1,"Master the basics of Hindi as a first language, focusing on script, grammar, and effective communication.","Enhance your proficiency in Hindi as a first language by mastering script, grammar, and pronunciation, and develop strong communication skills to effectively express, comprehend, and engage in diverse contexts and interactions."
,,,Hindi L2,"Develop essential skills in Hindi as a second language, including script, grammar, and communication techniques.","Advance your Hindi as a second language by refining script, grammar, and pronunciation, and enhancing communication skills to facilitate effective expression, understanding, and interaction in varied contexts and everyday situations."
,,,Hindi L3,"Enhance your proficiency in Hindi as a third language by focusing on grammar, vocabulary, and advanced communication techniques.","Strengthen your proficiency in Hindi as a third language by refining grammar, expanding vocabulary, and mastering advanced communication techniques, enabling effective expression and interaction in diverse situations."
,Semantic Memory,"Test your ability to recall and utilize meaningful information, focusing on memory for concepts and language-related tasks.",Business,"Uncover fundamental concepts of business, including management, finance, marketing, and operations.","Dive into the business world by understanding key principles of management, finance, marketing, and operations, and develop the skills needed to navigate challenges, identify opportunities, and drive success in various business environments."
,,,Current Affairs,"Stay updated with the latest developments in politics, economics, science, and global events.","Keep abreast of current affairs by exploring recent developments in politics, science, and global events, gaining insights into their implications, and developing a comprehensive understanding of the dynamic changes shaping our world today."
,,,Food,"Explore the diverse world of food, including cuisine types, nutritional values, and culinary techniques.","Delve into the fascinating world of food by understanding various cuisine types, nutritional values, and culinary techniques, enhancing your knowledge of ingredients, cooking methods and cultural significance."
,,,General Trivia,"Discover interesting facts and knowledge across various topics, from history to science and pop culture.","Engage in general trivia by exploring a wide range of fascinating facts and information across diverse topics, including history, science, pop culture, and more, enriching your knowledge and sharpening your mind."
,,,Geography,"Dive into the study of Earth's landscapes, environments, and the relationships between people and their environments.","Explore the field of geography by examining Earth's diverse landscapes, climates, and ecosystems, understanding the relationships between people and their environments and gaining insights into spatial patterns"
,,,History,"Journey through significant events, cultures, and figures that have shaped human civilization over time.","Travel through history by uncovering pivotal events, influential cultures, and notable figures that have shaped human civilization, gaining a deeper understanding of the past and its impact on present and future societies."
,,,Humanities,"Delve into the study of human culture, including literature, philosophy, art, and history, to understand our world.","Explore the humanities by examining human culture through literature, philosophy, art, and history, gaining insights into the diverse expressions of human thought and understanding the cultural, social, and historical contexts that shape our world."
,,,Lifestyle,"Discover aspects of daily living, including health, wellness, fashion, and personal habits that shape our lives.","Immerse yourself in lifestyle topics by exploring various aspects of daily living, such as health, wellness, fashion, and personal habits, gaining insights into practices that enhance well-being, and influence overall quality of life."
,,,Literature,"Explore the world of literature, encompassing classic and contemporary works, literary genres, and critical analysis.","Delve into literature by examining classic and contemporary works, understanding diverse literary genres, and developing skills in critical analysis, enriching your appreciation for the written word and its profound impact on culture and society."
,,,Movies,"Discover the magic of cinema, exploring film genres, notable directors, and the impact of movies on culture.","Immerse yourself in the world of movies by exploring various film genres, studying the works of notable directors, and understanding the cultural impact of cinema, appreciating the artistry, storytelling, and technological advancements."
,,,Music,"Explore the elements of music, including genres, history, and the role of music in culture and society.","Dive into the realm of music by exploring various genres, understanding its historical development, and examining its cultural significance, gaining insights into how music influences and reflects societal values."
,,,Nature,"Explore the beauty and complexity of nature, including ecosystems, wildlife, and natural phenomena.","Delve into nature by studying diverse ecosystems, wildlife, and natural phenomena, gaining insights into the interconnectedness of living organisms and their environments, and appreciating the intricate balance and beauty of the natural world."
,,,Personalities,"Discover diverse personalities, including influential figures and psychological traits that shape human behavior.","Explore the realm of personalities by studying diverse influential figures and understanding psychological traits that shape human behavior, gaining insights into how different personalities impact interactions, leadership, and societal roles."
,,,Politics,"Examine political systems, ideologies, and key figures that influence governance and public policy.","Delve into politics by analyzing various political systems, ideologies, and key figures who shape governance and public policy, gaining insights into the mechanisms of power, decision-making processes, and their impact on society."
,,,Pop Culture,"Explore the trends, icons, and media that define contemporary pop culture and influence societal norms.","Dive into pop culture by examining current trends, influential icons, and various forms of media, understanding how these elements shape societal norms, trends, and everyday life, and analyzing their impact on global and local cultures."
,,,Science,"Explore fundamental scientific principles, discoveries, and advancements across various fields of study.","Delve into science by examining core principles, groundbreaking discoveries, and advancements across diverse fields, understanding how scientific research drives innovation, enhances knowledge, and addresses complex challenges."
,,,Sports,"Discover the world of sports, including major games, athletic skills, and the cultural significance of various sports.","Immerse yourself in sports by exploring major games, athletic skills, and the cultural impact of various sports, understanding how they shape societal values and influence global and local cultures through competition and teamwork."
,,,Technology,"Examine technological advancements, innovations, and their impact on modern life and future developments.","Explore technology by analyzing key advancements, innovations, and their effects on everyday life and future progress, understanding how technological developments transform industries, enhance connectivity and drive societal change"
,,,,,
Trait Series,Trait Series,"Evaluate your understanding of key personality traits and their impact on behavior, motivation, and leadership.",DISC,"This evaluation measures your understanding of the DISC personality framework, focusing on behavioral tendencies, communication styles, and interpersonal dynamics.","Evaluate your understanding of the DISC personality assessment. Identify your dominant behavioral styles, improve communication strategies, and enhance interpersonal interactions to foster better team dynamics and personal growth."
,,,Big5,"This assessment gauges your traits according to the Big Five personality model, emphasizing openness, conscientiousness, extraversion, agreeableness, and emotional stability.","Assess your alignment with the Big Five personality traits. Explore your levels of openness, conscientiousness, extraversion, agreeableness, and emotional stability to gain insights into your personality and its impact on professional and personal relationships."
,,,Intrinsic work value,"This assessment measures your intrinsic work values using WEI and WIS, focusing on personal satisfaction, work ethics, and value alignment in the workplace.","Measure your intrinsic work values with the WEI and WIS tools. Understand what drives your job satisfaction, align your values with workplace expectations, and enhance your overall career fulfillment."
,,,Motivation,"This evaluation measures your motivational drivers with WEIMS, focusing on intrinsic and extrinsic motivators, goal-setting, and performance enhancement.","Evaluate your motivational drivers through the WEIMS framework. Identify your key motivators, set effective goals, and enhance your drive and performance in various settings to achieve personal and professional success."
,,,RIASEC,"This evaluation assesses your interests based on the RIASEC model, focusing on realistic, investigative, artistic, social, enterprising, and conventional career preferences.","Examine your career interests using the RIASEC model. Discover your preferences across realistic, investigative, artistic, social, enterprising, and conventional domains to guide career decisions and personal development."
,,,Leadership Strength,"This assessment evaluates your leadership strengths through Belbins Team Roles, focusing on how you contribute to team dynamics, role effectiveness, and leadership potential.","Assess your leadership strengths with Belbins Team Roles framework. Understand how your role contributes to team effectiveness, improve your leadership approach, and optimize team collaboration and performance."
,,,,,
Skill Series,Specialization Skills,"Assess your proficiency in specialized technical skills, covering a range of tools and technologies essential for effective performance in various domains.",Adobe Analytics,"This test assesses your proficiency in Adobe Analytics, examining key concepts, implementation, and data analysis.",Assess your proficiency in Adobe Analytics by tracking and analyzing digital marketing performance. Gain insights into visitor behavior and campaign success to make data-driven decisions for optimizing marketing strategies.
,,,Angular,"This assessment examines your knowledge of Angular, emphasizing core framework principles, component-based architecture, and advanced web development practices.","Measure your mastery of Angular for front-end development. Build dynamic web applications, implement responsive design, and optimize performance to advance your web development skills."
,,,AWS,"This assessment evaluates your expertise in AWS, concentrating on key cloud services, infrastructure design, and advanced deployment methods.","Assess your expertise in AWS for scalable cloud solutions. Learn to design efficient architectures, manage cloud resources, and implement best practices for secure and cost-effective cloud deployments."
,,,Azure,"This assessment measures your proficiency with Microsoft Azure, focusing on cloud computing services, deployment strategies, and security protocols.","Evaluate your skills in Microsoft Azure for cloud-based solutions. Deploy, manage, and monitor cloud services to build scalable and secure cloud applications, enhancing your technical expertise."
,,,Calendly,This evaluation measures your expertise in using Calendly for scheduling and calendar management.,"Evaluate your skills with Calendly by streamlining your scheduling process. Demonstrate your ability to automate meeting bookings, sync calendars, and manage time efficiently, reducing scheduling conflicts."
,,,CircleCI,"This test gauges your understanding of CircleCI, including continuous integration, deployment pipelines, and automation.","Test your knowledge of CircleCI for continuous integration and deployment. Show your expertise in automating software development processes, improving code quality, and accelerating release cycles through efficient build and test automation."
,,,Cisco ASA,"This exam evaluates your knowledge of Cisco ASA, focusing on firewall configurations, VPN setups, and security policies.","Validate your expertise in Cisco ASA by configuring and managing advanced security features. Demonstrate your ability to secure networks with firewall settings, VPNs, and intrusion prevention systems, protecting organizational data."
,,,Cisco Packet Tracer,"This test assesses your ability to use Cisco Packet Tracer for network simulation, configuration, and troubleshooting.","Assess your skills in Cisco Packet Tracer by designing, configuring, and troubleshooting network scenarios. Enhance your practical networking abilities and prepare for Cisco certification exams."
,,,Clio,"This evaluation measures your proficiency in using Clio for legal practice management, including case management and billing.","Evaluate your proficiency in Clio, the legal practice management software. Manage cases, track time, automate billing, and streamline legal operations to improve efficiency and client satisfaction."
,,,Confluence,"This exam evaluates your expertise in using Confluence for team collaboration, document management, and project tracking.","Test your knowledge of Confluence for team collaboration and knowledge management. Create, organize, and share documentation to improve communication and ensure everyone is aligned and informed."
,,,CRM,"This test measures your understanding of CRM systems, focusing on customer relationship management, sales, and marketing automation.","Assess your skills in using CRM systems. Manage customer interactions, track sales pipelines, and analyze data to enhance customer relationships and drive business growth."
,,,D3.js,"This evaluation gauges your skills in using D3.js for data visualization, including chart creation and interactivity.","Evaluate your mastery of D3.js for creating dynamic and interactive data visualizations. Demonstrate your ability to bind data to a DOM, apply data-driven transformations, and make data come alive on the web."
,,,Django,"This test assesses your proficiency in using Django for web development, including framework components and best practices.","Test your expertise in Django, the high-level Python web framework. Build secure, scalable web applications and streamline development using Django's robust features and best practices."
,,,Docker,"This evaluation measures your knowledge of Docker, focusing on containerization, image management, and orchestration.","Assess your skills in Docker for containerizing applications. Demonstrate your ability to create, manage, and orchestrate containers, ensuring consistent environments and improving deployment efficiency."
,,,DocuSign,This test evaluates your expertise in using DocuSign for digital signatures and document management.,"Evaluate your proficiency with DocuSign to streamline document signing processes. Manage electronic agreements, ensure compliance, and enhance the efficiency of document workflows."
,,,Drupal,"This assessment measures your proficiency in using Drupal for content management, including module development and site administration.","Test your mastery of Drupal for building and managing content-rich websites. Create custom modules, themes, and manage content to deliver flexible and robust web solutions."
,,,Freshdesk,This exam evaluates your knowledge of using Freshdesk for customer support and helpdesk management.,"Assess your expertise in Freshdesk for customer support management. Track tickets, automate workflows, and provide exceptional customer service to improve satisfaction and streamline support operations."
,,,GAAP,This test measures your understanding of Generally Accepted Accounting Principles (GAAP) for financial reporting and compliance.,"Evaluate your understanding of GAAP (Generally Accepted Accounting Principles). Ensure accurate financial reporting, compliance, and informed decision-making based on standardized accounting practices."
,,,GCP,"This evaluation gauges your skills in using Google Cloud Platform (GCP) for cloud computing, including services, deployment, and management.","Test your knowledge of Google Cloud Platform (GCP) for cloud computing solutions. Deploy and manage scalable applications, utilize various GCP services, and enhance your cloud infrastructure expertise."
,,,Git,"This test evaluates your proficiency in using Git for version control, including branching, merging, and collaboration.","Assess your proficiency in Git for version control. Manage code repositories, track changes, and collaborate effectively with your team to ensure seamless development workflows and project integrity."
,,,Google Analytics,"This assessment checks your proficiency in Google Analytics, covering data tracking, analysis, and utilizing advanced reporting features.","Measure your skills in Google Analytics for digital marketing and web analysis. Track and interpret website data, create detailed reports, and optimize online performance to enhance marketing strategies."
